<?xml version="1.0" encoding="UTF-8"?>
<!DOCTYPE list SYSTEM "spawn.dtd">
<list>

	<!--Ketra Village -->
	<spawn group="kv_fire_post_1" name="kv_fire_post">

		<npc id="40031" count="1" respawn="600" pos="135944 -78920 -4024 0" />	<!--Пост огня -->
		<npc id="40035" count="1" respawn="60" pos="136244 -78920 -4024 0" />	<!--Гвард -->
		<npc id="40035" count="1" respawn="60" pos="136094 -78660 -4024 10917" />	<!--Гвард -->
		<npc id="40035" count="1" respawn="60" pos="135794 -78660 -4024 21833" />	<!--Гвард -->
		<npc id="40035" count="1" respawn="60" pos="135644 -78920 -4024 32750" />	<!--Гвард -->
		<npc id="40035" count="1" respawn="60" pos="135794 -79180 -4024 43667" />	<!--Гвард -->
		<npc id="40035" count="1" respawn="60" pos="136094 -79180 -4024 54583" />	<!--Гвард -->

		<!--<npc id="40031" count="1" respawn="600" pos="140696 -77080 -4688 0" />	&lt;!&ndash;Пост огня &ndash;&gt;
		<npc id="40035" count="1" respawn="60" pos="140946 -77080 -4688 0" />	&lt;!&ndash;Гвард &ndash;&gt;
		<npc id="40035" count="1" respawn="60" pos="140821 -76863 -4688 10917" />	&lt;!&ndash;Гвард &ndash;&gt;
		<npc id="40035" count="1" respawn="60" pos="140571 -76863 -4688 21833" />	&lt;!&ndash;Гвард &ndash;&gt;
		<npc id="40035" count="1" respawn="60" pos="140446 -77080 -4688 32750" />	&lt;!&ndash;Гвард &ndash;&gt;
		<npc id="40035" count="1" respawn="60" pos="140571 -77297 -4688 43667" />	&lt;!&ndash;Гвард &ndash;&gt;
		<npc id="40035" count="1" respawn="60" pos="140821 -77297 -4688 54583" />	&lt;!&ndash;Гвард &ndash;&gt;-->

		<npc id="40005" count="1" respawn="60" pos="135864 -78808 -4016 0" />	<!--Баффер -->
		<npc id="40032" count="1" respawn="60" pos="135992 -79032 -4016 0" />	<!--Капитан -->

        <!--<npc id="40005" count="1" respawn="60" pos="140744 -77176 -4704 0" />	&lt;!&ndash;Баффер &ndash;&gt;
        <npc id="40032" count="1" respawn="60" pos="140712 -77000 -4672 0" />	&lt;!&ndash;Капитан &ndash;&gt;-->

        <npc id="40035" count="1" respawn="60" pos="136294 -78920 -4024 0"/>    <!--Гвард -->
        <npc id="40035" count="1" respawn="60" pos="136119 -78617 -4024 10917"/>    <!--Гвард -->
        <npc id="40035" count="1" respawn="60" pos="135769 -78617 -4024 21833"/>    <!--Гвард -->
        <npc id="40035" count="1" respawn="60" pos="135594 -78920 -4024 32750"/>    <!--Гвард -->
        <npc id="40035" count="1" respawn="60" pos="135769 -79223 -4024 43667"/>    <!--Гвард -->
        <npc id="40035" count="1" respawn="60" pos="136119 -79223 -4024 54583"/>    <!--Гвард -->

        <npc id="42000" count="1" respawn="60" pos="136031 -78902 -4024 5065"/>    <!--Гвард -->
        <npc id="42000" count="1" respawn="60" pos="135864 -78924 -4008 78"/>    <!--Гвард -->

        <!--<npc id="40035" count="1" respawn="60" pos="141046 -77080 -4688 0" />	&lt;!&ndash;Гвард &ndash;&gt;
        <npc id="40035" count="1" respawn="60" pos="140871 -76777 -4688 10917" />	&lt;!&ndash;Гвард &ndash;&gt;
        <npc id="40035" count="1" respawn="60" pos="140521 -76777 -4688 21833" />	&lt;!&ndash;Гвард &ndash;&gt;
        <npc id="40035" count="1" respawn="60" pos="140346 -77080 -4688 32750" />	&lt;!&ndash;Гвард &ndash;&gt;
        <npc id="40035" count="1" respawn="60" pos="140521 -77383 -4688 43667" />	&lt;!&ndash;Гвард &ndash;&gt;
        <npc id="40035" count="1" respawn="60" pos="140871 -77383 -4688 54583" />	&lt;!&ndash;Гвард &ndash;&gt;-->
    </spawn>

	<spawn group="kv_water_post_1" name="kv_water_post">
		<npc id="40038" count="1" respawn="600" pos="145464 -70456 -4080 0" />	<!--Пост воды -->
		<npc id="40042" count="1" respawn="60" pos="145714 -70456 -4080 0" />	<!--Гвард -->
		<npc id="40042" count="1" respawn="60" pos="145589 -70239 -4080 10917" />	<!--Гвард -->
		<npc id="40042" count="1" respawn="60" pos="145339 -70239 -4080 21833" />	<!--Гвард -->
		<npc id="40042" count="1" respawn="60" pos="145214 -70456 -4080 32750" />	<!--Гвард -->
		<npc id="40042" count="1" respawn="60" pos="145339 -70673 -4080 43667" />	<!--Гвард -->
		<npc id="40042" count="1" respawn="60" pos="145589 -70673 -4080 54583" />	<!--Гвард -->

        <npc id="40005" count="1" respawn="60" pos="145480 -70552 -4080 0"/>    <!--Баффер -->
        <npc id="40039" count="1" respawn="60" pos="145480 -70360 -4072 0"/>    <!--Капитан -->

        <npc id="40042" count="1" respawn="60" pos="145814 -70456 -4080 0"/>    <!--Гвард -->
        <npc id="40042" count="1" respawn="60" pos="145639 -70153 -4080 10917"/>    <!--Гвард -->
        <npc id="40042" count="1" respawn="60" pos="145289 -70153 -4080 21833"/>    <!--Гвард -->
        <npc id="40042" count="1" respawn="60" pos="145114 -70456 -4080 32750"/>    <!--Гвард -->
        <npc id="40042" count="1" respawn="60" pos="145289 -70759 -4080 43667"/>    <!--Гвард -->
        <npc id="40042" count="1" respawn="60" pos="145639 -70759 -4080 54583"/>    <!--Гвард -->

        <npc id="42001" count="1" respawn="60" pos="145577 -70459 -4072 108"/>    <!--Гвард -->
        <npc id="42001" count="1" respawn="60" pos="145384 -70461 -4080 11247"/>    <!--Гвард -->
    </spawn>

</list>