<?xml version="1.0" encoding="UTF-8"?>
<!DOCTYPE list SYSTEM "spawn.dtd">
<list>

	<!-- Talking Insland  -->
	<spawn group="ti_fire_post_1" name="ti_fire_post">
	
	<npc id="40031" count="1" respawn="600" pos="-106072 232296 -3648 0" />	<!--Пост огня -->
	
	<npc id="40035" count="1" respawn="60" pos="-105772 232296 -3648 0" />
	<npc id="40035" count="1" respawn="60" pos="-105812 232446 -3648 5458" /> 
	<npc id="40035" count="1" respawn="60" pos="-105922 232556 -3648 10917" /> 
	<npc id="40035" count="1" respawn="60" pos="-106072 232596 -3648 16375" /> 
	<npc id="40035" count="1" respawn="60" pos="-106222 232556 -3648 21833" /> 
	<npc id="40035" count="1" respawn="60" pos="-106332 232446 -3648 27292" /> 
	<npc id="40035" count="1" respawn="60" pos="-106372 232296 -3648 32750" /> 
	<npc id="40035" count="1" respawn="60" pos="-106332 232146 -3648 38208" /> 
	<npc id="40035" count="1" respawn="60" pos="-106222 232036 -3648 43667" /> 
	<npc id="40035" count="1" respawn="60" pos="-106072 231996 -3648 49125" /> 
	<npc id="40035" count="1" respawn="60" pos="-105922 232036 -3648 54583" /> 
	<npc id="40035" count="1" respawn="60" pos="-105812 232146 -3648 60042" />
	
	<npc id="40005" count="1" respawn="60" pos="-105944 232280 -3648 0" />	<!--Баффер -->
	<npc id="40032" count="1" respawn="60" pos="-106264 232248 -3656 0" />	<!--Капитан -->
		
	</spawn>

	<spawn group="ti_water_post_1" name="ti_water_post">
	
	<npc id="40038" count="1" respawn="600" pos="-105448 224472 -3648 0" />	<!--Пост воды -->
	
	<npc id="40042" count="1" respawn="60" pos="-105148 224472 -3648 0" />
	<npc id="40042" count="1" respawn="60" pos="-105188 224622 -3648 5458" />
	<npc id="40042" count="1" respawn="60" pos="-105298 224732 -3648 10917" /> 
	<npc id="40042" count="1" respawn="60" pos="-105448 224772 -3648 16375" /> 
	<npc id="40042" count="1" respawn="60" pos="-105598 224732 -3648 21833" /> 
	<npc id="40042" count="1" respawn="60" pos="-105708 224622 -3648 27292" /> 
	<npc id="40042" count="1" respawn="60" pos="-105748 224472 -3648 32750" /> 
	<npc id="40042" count="1" respawn="60" pos="-105708 224322 -3648 38208" /> 
	<npc id="40042" count="1" respawn="60" pos="-105598 224212 -3648 43667" /> 
	<npc id="40042" count="1" respawn="60" pos="-105448 224172 -3648 49125" /> 
	<npc id="40042" count="1" respawn="60" pos="-105298 224212 -3648 54583" /> 
	<npc id="40042" count="1" respawn="60" pos="-105188 224322 -3648 60042" />
	
	<npc id="40005" count="1" respawn="60" pos="-105592 224472 -3648 0" />	<!--Баффер -->
	<npc id="40039" count="1" respawn="60" pos="-105256 224504 -3640 0" />	<!--Капитан -->

	</spawn>

</list>